{
  "agent": "data-schema-keeper",
  "ts": "2026-04-25T20:15:00Z",
  "status": "complete",
  "files_changed": [],
  "notes": "Run 2 validation. All artifacts PASS.\n\n--- state.json ---\nPASS: All 9 required top-level fields present with correct types (schema_version=1 int, last_updated string, current_week=1 int, current_pod_focus string, completed array, in_progress array, blocked array, human_gates_pending array, dispatch_count=21 int). completed[] now has 8 entries (r3f-scaffolder, scene-architect-3d, physics-engine-3d, asset-pipeline-3d, input-controller-3d, data-schema-keeper, tts-voice-config, tts-dialog-integration) — count confirmed correct. Every completed[] entry has agent+ts. in_progress[] contains exactly one entry (data-schema-keeper run 2 mid-flight), confirmed expected. blocked[] and human_gates_pending[] are empty arrays.\n\n--- receipts/ glob ---\nPASS: 16 files found on disk. All 16 expected files present (8 worker receipts + 8 reviewer receipts). No unexpected extras.\n\n--- physics-engine-3d-2026-04-25T06-57-03Z.json ---\nPASS: All required fields present (agent, ts, status=complete, files_changed, notes). Schema-conformant. No reviewer-specific fields required for worker receipts.\n\n--- code-quality-reviewer-2026-04-25T07-08-00Z.json ---\nPASS: All required fields present including verdict=PASS and reviewed_agent=physics-engine-3d. Reviewer-specific fields satisfied.\n\n--- asset-pipeline-3d-2026-04-25T08-00-00Z.json ---\nPASS: All required fields present (agent, ts, status=complete, files_changed, notes). Schema-conformant.\n\n--- code-quality-reviewer-2026-04-25T08-10-00Z.json ---\nPASS: All required fields present including verdict=PASS and reviewed_agent=asset-pipeline-3d. Reviewer-specific fields satisfied.\n\n--- input-controller-3d-2026-04-25T09-15-00Z.json ---\nPASS: All required fields present (agent, ts, status=complete, files_changed, notes). Schema-conformant.\n\n--- code-quality-reviewer-2026-04-25T10-45-00Z.json ---\nPASS: All required fields present including verdict=NEEDS_REVISION and reviewed_agent=input-controller-3d. verdict value is in the allowed set {PASS, NEEDS_REVISION, FAIL}. Reviewer-specific fields satisfied.\n\n--- input-controller-3d-cycle2-2026-04-25T11-30-00Z.json ---\nPASS: All required fields present (agent, ts, status=complete, files_changed, notes). Schema-conformant.\n\n--- code-quality-reviewer-2026-04-25T11-45-00Z.json ---\nPASS: All required fields present including verdict=PASS and reviewed_agent=input-controller-3d. Reviewer-specific fields satisfied.\n\n--- data-schema-keeper-2026-04-25T12-00-00Z.json ---\nPASS: All required fields present (agent, ts, status=complete, files_changed=[], notes). Schema-conformant. This is run 1's own receipt.\n\n--- tts-voice-config-2026-04-25T13-15-00Z.json ---\nPASS: All required fields present (agent, ts, status=complete, files_changed, notes). Schema-conformant. New since run 1.\n\n--- code-quality-reviewer-2026-04-25T13-30-00Z.json ---\nPASS: All required fields present including verdict=PASS and reviewed_agent=tts-voice-config. Reviewer-specific fields satisfied. New since run 1.\n\n--- tts-dialog-integration-2026-04-25T19-12-46Z.json ---\nPASS: All required fields present (agent, ts, status=complete, files_changed, notes). Schema-conformant. New since run 1.\n\n--- code-quality-reviewer-2026-04-25T19-20-00Z.json (retracted FAIL) ---\nPASS: Schema-valid despite retracted verdict. All required fields present including verdict=FAIL (valid enum value) and reviewed_agent=tts-dialog-integration. The misattribution narrative is in notes; schema does not enforce business logic on verdicts. Schema-conformant.\n\n--- code-quality-reviewer-2026-04-25T19-45-00Z.json (authoritative cycle-1 re-review) ---\nPASS: All required fields present including verdict=NEEDS_REVISION and reviewed_agent=tts-dialog-integration. Notes document retraction of previous FAIL. Reviewer-specific fields satisfied. New since run 1.\n\n--- tts-dialog-integration-cycle2-2026-04-25T20-00-00Z.json ---\nPASS: All required fields present (agent, ts, status=complete, files_changed, notes). Schema-conformant. New since run 1.\n\n--- code-quality-reviewer-2026-04-25T20-05-00Z.json (cycle-2 PASS) ---\nPASS: All required fields present including verdict=PASS and reviewed_agent=tts-dialog-integration. Reviewer-specific fields satisfied. New since run 1.\n\n--- sequencing.yaml ---\nPASS (DAG / prereq resolution): All prerequisite references resolve to valid agent keys within the file or to r3f-scaffolder (external entry point, not required to be declared). Dependency graph is a clean DAG: r3f-scaffolder -> scene-architect-3d -> {physics-engine-3d, asset-pipeline-3d, input-controller-3d} -> screen-grid-architect -> {save-bridge, screen-loader} -> edge-detector -> screen-transition-fx. tts-voice-config has empty prerequisites; tts-dialog-integration depends on tts-voice-config — both resolve. data-schema-keeper and code-quality-reviewer have empty prerequisites. No cycles detected.\nPASS (agent definition files — sequenced agents with .md): scene-architect-3d, physics-engine-3d, asset-pipeline-3d, input-controller-3d, data-schema-keeper, code-quality-reviewer, tts-voice-config, tts-dialog-integration — all 8 confirmed present under .claude/agents/.\nKNOWN GAPS (informational, not FAIL — same as run 1): screen-grid-architect, save-bridge, screen-loader, edge-detector, screen-transition-fx have no .claude/agents/<name>.md. These are queued, not yet authored.\nNEW (run 2 check): .claude/agents/tts-voice-config.md — PRESENT. .claude/agents/tts-dialog-integration.md — PRESENT. Both confirmed by Glob.\n\n--- asset-manifest.schema.json ---\nPASS: Valid JSON Schema draft-07 ($schema field present, type=object, required=[screen_id], additionalProperties=true at root and every item level for models/textures/audio). Unchanged since run 1.\n\n--- proof-of-life.manifest.json ---\nPASS: screen_id present (value: proof-of-life), all optional arrays present and empty, _note field permitted by additionalProperties=true. Validates against schema. Unchanged since run 1.\n\n--- world-grid.json ---\nNOT PRESENT: No action required.\n\n--- save schema ---\nNOT PRESENT: No action required."
}
