{
  "agent": "audio-compression-pass",
  "ts": "2026-04-26T02:00:00Z",
  "status": "blocked",
  "files_changed": [],
  "blockers_discovered": [
    {
      "description": "ffmpeg not on PATH. Verified via `ffmpeg -version` in bash (command not found), PowerShell (CommandNotFoundException), and direct probes of common Windows install locations (C:\\ffmpeg\\bin, C:\\Program Files\\ffmpeg\\bin, C:\\ProgramData\\chocolatey\\bin, C:\\tools\\ffmpeg\\bin, scoop apps + shims, WinGet Links) — none exist. Per spec Step 2 we do NOT attempt alternative encoders this cycle. Action required: install ffmpeg with libvorbis (preferred) or libmp3lame, ensure it's on PATH, then re-dispatch this agent.",
      "blocks_agents": ["audio-compression-pass", "audio-asset-cleanup"]
    }
  ],
  "next_agent_suggestions": ["audio-compression-pass"],
  "notes": "INVENTORY\n--------\nTotal .wav files scanned (under public/ and src/): 5. All 5 live under public/game/audio/.\n\nClassification:\n- has_valid_compressed: 0\n- missing_compressed: 0\n- zero_byte_sibling: 5\n\nWORK QUEUE (5 files, all zero_byte_sibling — .ogg exists at 0 bytes, .mp3 missing)\n----------\n1. public/game/audio/music/garage_warm_oud.wav (wav=2,822,444 B; ogg=0 B; mp3=absent) — bitrate target 128 kbps (music)\n2. public/game/audio/music/neighborhood_hybrid_ride.wav (wav=2,822,444 B; ogg=0 B; mp3=absent) — bitrate target 128 kbps (music)\n3. public/game/audio/music/quest_focus_hybrid.wav (wav=2,116,844 B; ogg=0 B; mp3=absent) — bitrate target 128 kbps (music)\n4. public/game/audio/stingers/reward_tarabi_stinger.wav (wav=388,124 B; ogg=0 B; mp3=absent) — bitrate target 96 kbps (stinger)\n5. public/game/audio/stingers/upgrade_unlock_hybrid.wav (wav=458,684 B; ogg=0 B; mp3=absent) — bitrate target 96 kbps (stinger)\n\nThis exactly matches the known-bad five from .claude/swarm/blockers/audio-asset-cleanup-needs-revision-2026-04-26T01-50-00Z.md. No additional surprises in the audio tree.\n\nFFMPEG AVAILABILITY\n-------------------\nffmpeg version: NOT INSTALLED / NOT ON PATH.\n- bash: `ffmpeg: command not found`\n- PowerShell: `CommandNotFoundException`\n- Direct path probes (none found): C:\\ffmpeg\\bin\\ffmpeg.exe, C:\\Program Files\\ffmpeg\\bin\\ffmpeg.exe, C:\\ProgramData\\chocolatey\\bin\\ffmpeg.exe, C:\\tools\\ffmpeg\\bin\\ffmpeg.exe, %USERPROFILE%\\scoop\\apps\\ffmpeg\\current\\bin\\ffmpeg.exe, %USERPROFILE%\\scoop\\shims\\ffmpeg.exe, %LOCALAPPDATA%\\Microsoft\\WinGet\\Links\\ffmpeg.exe.\n- libvorbis availability: unknown (cannot probe without ffmpeg).\n- libmp3lame availability: unknown (cannot probe without ffmpeg).\n\nPer spec Step 2: when ffmpeg is not on PATH, write blocked receipt and STOP — do not try alternative encoders this cycle.\n\nVERIFICATION OF NON-MUTATION\n----------------------------\nNO .wav files were modified, deleted, or renamed. NO encodes were attempted. NO new files were written under public/ or src/. Verified via `git status --short` — only .claude/swarm/state.json shows modified (orchestrator state, not in scope), no audio paths in diff, no untracked files under public/game/audio/.\n\nGREEN-LIGHT STATEMENT\n---------------------\nBLOCKED. audio-asset-cleanup must NOT be re-dispatched until this agent completes a successful pass. The 5 zero-byte .ogg placeholders remain in place; archiving the .wav masters now would re-trigger the silent-audio incident from 2026-04-26T01:35Z.\n\nREMEDIATION\n-----------\nUser action: install ffmpeg with libvorbis support (e.g. `winget install Gyan.FFmpeg` or `choco install ffmpeg`), confirm `ffmpeg -version` works in a fresh shell, then re-dispatch audio-compression-pass. The work queue inventory above can be reused verbatim — no re-discovery needed unless the audio tree changes in the meantime."
}
