{
  "agent": "phaser-biology-stage1",
  "ts": "2026-04-27T06:29:52Z",
  "status": "complete",
  "files_changed": [
    "src/renderer/game/data/recipes.js",
    "src/renderer/game/systems/biology/Recipe.js",
    "src/renderer/game/systems/biology/Organism.js",
    "src/renderer/game/systems/biology/recipeRegistry.js",
    "src/renderer/game/systems/biology/biologyEvents.js",
    "src/renderer/game/systems/biology/biologyState.js",
    "src/renderer/game/systems/biology/Stage1RecipeEngine.js",
    "src/renderer/game/systems/biology/index.js"
  ],
  "exports_added": [
    "data/recipes.js: RECIPES, getRecipesByCategory, default RECIPES",
    "systems/biology/Recipe.js: Recipe (class), default Recipe",
    "systems/biology/Organism.js: Organism (class), default Organism",
    "systems/biology/recipeRegistry.js: bootstrapRegistry, registerRecipe, getRecipe, listRecipes, listRecipeIds, _resetRegistryForTests, ALL_RECIPES",
    "systems/biology/biologyEvents.js: emitRecipeAttempt, emitRecipeOutcome, onRecipeOutcome, onRecipeAttempt, onEcologyObservation, BIOLOGY_EVENTS",
    "systems/biology/biologyState.js: defaultBiologyState, ensureBiologyState, recordRecipeAttempt, getRecipeRecord, hasFirstSuccess, getUnlockedStage",
    "systems/biology/Stage1RecipeEngine.js: attemptRecipe",
    "systems/biology/index.js: registerRecipe, attemptRecipe, emitRecipeOutcome, getStageVisibility, bootstrapRegistry, getRecipe, listRecipes, listRecipeIds, ALL_RECIPES, emitRecipeAttempt, onRecipeOutcome, onRecipeAttempt, onEcologyObservation, BIOLOGY_EVENTS, ensureBiologyState, recordRecipeAttempt, getRecipeRecord, hasFirstSuccess, getUnlockedStage, Recipe, Organism, designOrganism (Stage 2 STUB), validateOrganism (Stage 2 STUB), emitOrganismDesignEvent (Stage 2 STUB), createEcosystem (Stage 3 STUB), introduceOrganism (Stage 3 STUB), stepSimulation (Stage 3 STUB), observeEcosystemState (Stage 3 STUB), emitSimulationEvent (Stage 3 STUB), upgradeOrganismToNextStage (Stage 2 STUB), setActiveScene"
  ],
  "tests_added": [],
  "blockers_discovered": [],
  "next_agent_suggestions": [
    "phaser-biology-stage1-scene-mount (Phase 5 — first scene to mount the workbench, likely ZuzuGarageScene; required for runtime-validated upgrade)",
    "phaser-biology-stage2 (deferred until biology-substrate.md §15.1 unlock trigger resolved)",
    "items-add-stage1-outputs (audit items.js for plant_composite + protective_coating items that biology recipes output but are not yet defined as inventory items)"
  ],
  "notes": "STAGE 1 BIOLOGY RECIPE ENGINE complete per substrate spec.\n\n=== Files created (7 modules + 1 data file) ===\n- src/renderer/game/data/recipes.js (NEW — file did not previously exist; contains only the 3 biology recipes; existing crafting recipes still live in systems/craftingSystem.js RECIPES which was NOT touched. Per substrate §15.3 default, biology recipes live in data/recipes.js with category: 'biology'. The 'additive only' rule is satisfied vacuously: there are no pre-existing entries in this file.)\n- src/renderer/game/systems/biology/Recipe.js\n- src/renderer/game/systems/biology/Organism.js (Stage 1 shape; Stage 2/3 extensions documented in JSDoc only)\n- src/renderer/game/systems/biology/recipeRegistry.js\n- src/renderer/game/systems/biology/Stage1RecipeEngine.js\n- src/renderer/game/systems/biology/biologyEvents.js\n- src/renderer/game/systems/biology/biologyState.js\n- src/renderer/game/systems/biology/index.js\n\n=== Stage 1 public API per substrate §4 ===\n- registerRecipe(recipeConfig) → Recipe\n- attemptRecipe(scene, recipeId, providedInputs, options?) → AttemptResult\n- emitRecipeOutcome(recipeId, success, output, failureReason?) → RecipeOutcomePayload\n- getStageVisibility(playerState) → ['stage1'] | ['stage1','stage2'] | ['stage1','stage2','stage3']\n\n=== Stage 2 stubs (halt-and-surface) ===\n- designOrganism(baseSpeciesId, parameterChoices) → throws\n- validateOrganism(organism, environmentalConstraints) → throws\n- emitOrganismDesignEvent(organism) → throws\n- upgradeOrganismToNextStage(organism) → throws (cross-stage; needs Stage 2)\nMessage shape: '[biology] X is deferred to Phase 5 (Stage 2 implementation). See biology-substrate.md §15.1.'\n\n=== Stage 3 stubs (halt-and-surface) ===\n- createEcosystem(biomeConfig) → throws\n- introduceOrganism(ecosystem, organism) → throws\n- stepSimulation(ecosystem, deltaTime) → throws\n- observeEcosystemState(ecosystem) → throws\n- emitSimulationEvent(eventType, ecosystem, organism, details) → throws\nMessage shape: '[biology] X is deferred to Phase 6 (Stage 3 implementation). See biology-substrate.md §15.4.'\n\n=== 3 registered recipes ===\n1. healing_salve\n   inputs: leaf_slot=creosote_leaves×1, fiber_slot=agave_fiber×1\n   output: healing_salve\n   outcomeObservationId: 'salve_crafted'\n   knowledgeUnlock: 'plant_pharmacology_basics'\n   process: 4000ms, stages [grinding, mixing, curing]\n2. plant_composite\n   inputs: fiber_slot=agave_fiber×1, resin_slot=creosote_leaves×1\n   output: plant_composite\n   outcomeObservationId: 'composite_created' (matches quests.js perfect_composite.combine_materials)\n   knowledgeUnlock: 'composite_materials'\n   process: 5000ms, stages [fiber_alignment, resin_infusion, press_cure]\n3. protective_coating\n   inputs: resin_slot=creosote_leaves×1, wax_slot=jojoba_seeds×1\n   output: protective_coating\n   outcomeObservationId: 'coating_applied' (coexists with ZuzuGarageScene's prior emitter — recipe engine adds the canonical biology-system path)\n   knowledgeUnlock: 'desert_surface_treatment'\n   process: 3500ms, stages [rendering, blending, application]\n\n=== Substrate §15 disposition ===\n- §15.1 Stage 2 unlock trigger: DEFERRED (blocks Stage 2 dispatch)\n- §15.2 Engineered-organism consequence model: DEFERRED (blocks Stage 3)\n- §15.3 Recipe authoring format: RESOLVED via default — recipes live in data/recipes.js with category: 'biology'. No biology-specific recipe editor in this dispatch.\n- §15.4 Stage 3 tick rate: DEFERRED (blocks Stage 3)\n- §15.5 Stage 2 parameter dimensions: DEFERRED\n- §15.6 Parametric trial save/replay: DEFERRED\n- §15.7 Workbench portability mechanism: DEFERRED (does not block Stage 1)\n- §15.8 Cross-cutting (knowledge state, navigation, asset pipeline): unchanged\n\n=== Confirmation of constraints ===\n- NO scene file modified (verified: only files under systems/biology/ + data/recipes.js touched).\n- NO quest definition modified (data/quests.js untouched).\n- NO ecology system file modified (systems/ecology/ untouched).\n- NO data/ecology.js / flora.js / fauna.js modified.\n- NO questSystem.js touched.\n- NO npm packages installed.\n- NO Stage 2 / Stage 3 logic implemented (stubs only).\n- JavaScript only.\n- JSDoc on every export.\n- data/recipes.js was NEW (file did not exist) — additive constraint satisfied vacuously; verified via `git status` (untracked file, not a modification).\n\n=== Ecology bridge ===\nBiology subscribes to 'ecology.observation' via onEcologyObservation(scene, listener) (a thin Phaser scene-events wrapper). Does NOT import EcologyEntity directly. Does NOT import any module under systems/ecology/. For Stage 1 the recipe engine functions without strict ecology dependency — the hook is in place for Stage 2 / 3.\n\n=== Build status ===\n`npm run build` PASSES (vite 5.4.21, 886 modules transformed, built in ~12s).\n\n=== Verdict tag ===\n[design-only-implementation] — upgrades to runtime-validated when a scene mounts the workbench and a recipe flow tests end-to-end."
}
