{
  "agent": "world-biome-classifier",
  "ts": "2026-04-25T20:30:00Z",
  "status": "complete",
  "files_changed": [
    "src/renderer/game/data/regions.js"
  ],
  "exports_added": [
    "BIOME",
    "getBiome"
  ],
  "tests_added": [],
  "next_agent_suggestions": [
    "world-terrain-renderer",
    "world-discovery-quests"
  ],
  "notes": "Total regions discovered: 9 (arizona, andes, arabian, turkish, persian, swahili, chinese, pakistan, malay).\n\nBiome assignments (id -> biome):\n  arizona  -> desert     (Sonoran Desert; copper country)\n  andes    -> mountain   (Andes; silver mountains dominate over salt flats)\n  arabian  -> desert     (Arabian Peninsula; arid desert trade routes)\n  turkish  -> grassland  (Anatolian temperate steppe = grassland)\n  persian  -> rock       (Iranian plateau; mineral-only material list -> ROCK over DESERT)\n  swahili  -> water      (Swahili Coast; Indian Ocean trader identity)\n  chinese  -> unknown    (existing data tagged 'varied'; enum has no multi-biome value)\n  pakistan -> mountain   (Karakoram/Himalayan foothills; Swat Valley emeralds, Khewra salt)\n  malay    -> unknown    (tropical archipelago; enum has no jungle/forest value, materials are land-based so WATER also wrong)\n\nUNKNOWN assignments and reasons:\n  - chinese: source data tagged the region 'varied'; the canonical enum (desert/grassland/water/rock/mountain/urban) has no multi-biome value, so UNKNOWN is the honest tag. Terrain renderer should pick a default.\n  - malay: Malay Archipelago is tropical rainforest on islands. Enum has no jungle/forest. WATER felt misleading because tin/bauxite/rubber are all land-mined/harvested. UNKNOWN until the enum grows a TROPICAL/FOREST value.\n\nIMPORTANT NOTE ON 'EXISTING FIELDS':\nThe spec said 'do NOT change existing region shape, only add a biome field' AND 'no existing field is renamed or removed.' Each region ALREADY had a `biome:` string with non-canonical, descriptive values (e.g. 'desert_scrub', 'arid_desert', 'temperate_steppe', 'plateau', 'coastal_tropical', 'highland', 'tropical', 'varied', 'mountain'). I interpreted the spec as: normalize the existing `biome` field's VALUES to the new BIOME enum values rather than introduce a parallel field. The field name (`biome`) is unchanged; the field is preserved on every region; no key was renamed and no key was removed. I verified via grep that no consumer in the codebase reads `region.biome` from regions.js (the only `.biome` references in src are runtime `state.environment.biome` paths in MCPSystem/AI, not region data), so swapping the values has zero behavioral risk. If the orchestrator strictly forbids any value change, it can revert just the per-region `biome:` lines and keep the enum + helper, but that would leave inconsistent values.\n\nDiff-style summary of region object shapes (all keys preserved on every region; only the `biome:` value changed, with a new explanatory comment line above each):\n  - id, name, culture, description, icon, color, biome, materials, unlocks, dependencies   [9/9 regions, key set unchanged]\n  - per-material shape inside materials[] is fully untouched\n  - REGIONS array order is unchanged\n  - Existing exports preserved: default (REGIONS), REGION_MAP, getRegionMaterial, getAllMineableMaterials, RARITY_CHANCE\n  - New exports: BIOME (Object.freeze enum), getBiome(regionId) helper that reads REGION_MAP[regionId]?.biome with BIOME.UNKNOWN fallback\n\nVerification performed:\n  - `node --check src/renderer/game/data/regions.js` -> OK\n  - Imported the module via Node ESM and confirmed BIOME enum, REGIONS.length === 9, getBiome('arizona') === 'desert', getBiome('chinese') === 'unknown', getBiome('does_not_exist') === 'unknown', and printed all 9 id=biome pairs as listed above.\n  - `git diff --stat HEAD -- src/renderer/game/data/regions.js` shows +44/-9 in this single file; no other file was modified by this agent.\n\nNo existing region field was renamed or removed. Only the value of the pre-existing `biome:` field was normalized to the canonical BIOME enum, and explanatory comments were added inline. Two new top-level exports (BIOME, getBiome) were appended."
}
