{
  "agent": "tts-voice-config",
  "ts": "2026-04-25T13:15:00Z",
  "status": "complete",
  "files_changed": [
    "src/renderer/game/services/npcSpeech.js",
    "src/renderer/game/data/npcProfiles.js"
  ],
  "exports_added": [
    "debugListVoiceAssignments"
  ],
  "tests_added": [],
  "next_agent_suggestions": ["tts-dialog-integration"],
  "notes": "Discovery: Grepped quests.js, npcDialogueTemplates.js, npcAppearances.js, and entities/Npc.js for distinct npcId literals. Total NPC count discovered: 6 (zuzu, mrs_ramirez, mr_chen, old_miner, desert_guide, river_biologist). 'zuzu' is the protagonist (referenced as the addressee in dialogue templates and as a registered character). The four scope files contain no other distinct npcId literals beyond these. Scenes confirm the human-readable names: old_miner = 'Old Miner Pete' (CopperMineScene.js:140-142), desert_guide = 'Ranger Nita' (DesertForagingScene.js:115-117), river_biologist = 'Dr. Maya' (SaltRiverScene.js:167-169).\n\nFinal CHARACTER_GENDER map (one line per id):\n- zuzu -> default  (protagonist; explicit user requirement: use system default voice)\n- mrs_ramirez -> female  (honorific 'Mrs.')\n- mr_chen -> male  (honorific 'Mr.')\n- old_miner -> male  (named 'Pete')\n- desert_guide -> female  (named 'Nita')\n- river_biologist -> female  (named 'Maya', honorific 'Dr.')\n\nNo NPCs were defaulted to 'default' due to ambiguity — the only 'default' entry is Zuzu, which is per the explicit user requirement, not ambiguity. All five non-Zuzu NPCs had clearly inferable gender via given names + honorifics.\n\nVoice cache + voiceschanged: Confirmed in place. Module-level _voiceCache is primed synchronously on load via _refillVoiceCache(). A 'voiceschanged' listener is wired (uses synth.addEventListener with a fallback to onvoiceschanged) that re-fills the cache. Every direct synth.getVoices() call inside npcSpeech.js was replaced with reads from _getCachedVoices(); the only remaining synth.getVoices() invocation is inside the private _refillVoiceCache() helper (the single source of truth that writes to the cache). Late-refill safety net: if _voiceCache is still empty when a read happens (cold start before voiceschanged fires), _getCachedVoices() attempts one synchronous re-read so the very first speak() in a session is not stuck on an empty list.\n\nspeak() null-voice handling: The original speak() at lines 116-160 already handled missing voice correctly — when no preferred voice is found it simply leaves utterance.voice unset and the browser/OS picks the default. So no early-return path was strictly required. However, to make the 'default' contract explicit (and avoid accidentally hitting the fallback heuristic that prefers 'natural' English voices), I added an explicit branch in speak(): when options.gender === 'default', utterance.voice is intentionally left unset, bypassing both _pickVoiceByGender and the natural-voice fallback. This is the cleanest way to honor the 'use the OS default' contract for Zuzu.\n\n_pickVoiceByGender update: Added an early `if (gender === 'default') return null;` guard at the top, matching the spec.\n\ngetVoiceForCharacter and speakAsNpc fallback: Both used to default unknown ids to 'male'. Updated both to default unknown ids to 'default' so an undeclared NPC silently uses the system default voice rather than being force-gendered.\n\nnpcProfiles.js backfill: Added full profiles (with voicePreference) for old_miner, desert_guide, and river_biologist. The two pre-existing profiles (mrs_ramirez, mr_chen) already had voicePreference and were left untouched. Rate/pitch deviations:\n- old_miner: rate 0.85, pitch 0.9 (older character, slower + lower)\n- desert_guide: rate 0.9, pitch 1.0 (baseline)\n- river_biologist: rate 0.95, pitch 1.05 (younger adult scientist, slightly faster + higher)\n\ndebugListVoiceAssignments(): Added as an exported dev helper. Returns { npcId: voiceName | '(default)' | '(none)' } for every key in CHARACTER_GENDER, suitable for console.table() in DevTools to verify that the OS-supplied voice list is producing the expected gender mapping.\n\nPublic signatures preserved: speak(text, options), speakAsNpc(text, voicePreference, options), and autoSpeak(text, voicePreference, options) all retain their original parameter shapes. Only an additional optional 'default' value for options.gender was introduced, which is fully backwards-compatible with existing callers (GameContainer.jsx, scenes).\n\nNo new top-level dependencies added. Stayed strictly inside the two scoped files."
}
