{
  "agent": "data-schema-keeper",
  "ts": "2026-04-25T12:00:00Z",
  "status": "complete",
  "files_changed": [],
  "notes": "Validation run covering state.json, 8 receipts, receipt-schema.json, sequencing.yaml, asset-manifest.schema.json, and proof-of-life.manifest.json.\n\nstate.json — PASS: All 9 required top-level fields present with correct types (schema_version=1 int, last_updated ISO datetime, current_week=1 int, current_pod_focus string, completed array, in_progress array, blocked array, human_gates_pending array, dispatch_count=13 int). Each completed[] entry carries agent+ts. The single in_progress[] entry for data-schema-keeper carries agent+started_ts (expected mid-flight state).\n\nreceipt physics-engine-3d-2026-04-25T06-57-03Z.json — PASS: All required fields present (agent, ts, status=complete, files_changed, notes). Conforms to receipt-schema.json.\n\nreceipt asset-pipeline-3d-2026-04-25T08-00-00Z.json — PASS: All required fields present (agent, ts, status=complete, files_changed, notes). Conforms to receipt-schema.json.\n\nreceipt input-controller-3d-2026-04-25T09-15-00Z.json — PASS: All required fields present (agent, ts, status=complete, files_changed, notes). Conforms to receipt-schema.json.\n\nreceipt input-controller-3d-cycle2-2026-04-25T11-30-00Z.json — PASS: All required fields present (agent, ts, status=complete, files_changed, notes). Conforms to receipt-schema.json.\n\nreceipt code-quality-reviewer-2026-04-25T07-08-00Z.json — PASS: All required fields present including verdict=PASS and reviewed_agent=physics-engine-3d (mandatory for code-quality-reviewer type). Conforms to receipt-schema.json.\n\nreceipt code-quality-reviewer-2026-04-25T08-10-00Z.json — PASS: All required fields present including verdict=PASS and reviewed_agent=asset-pipeline-3d. Conforms to receipt-schema.json.\n\nreceipt code-quality-reviewer-2026-04-25T10-45-00Z.json — PASS: All required fields present including verdict=NEEDS_REVISION and reviewed_agent=input-controller-3d. Conforms to receipt-schema.json.\n\nreceipt code-quality-reviewer-2026-04-25T11-45-00Z.json — PASS: All required fields present including verdict=PASS and reviewed_agent=input-controller-3d. Conforms to receipt-schema.json.\n\nsequencing.yaml prerequisite resolution — PASS: All prerequisite references resolve to valid agent keys within the yaml (r3f-scaffolder is a valid external entry point, not in the yaml's agent list but not required to be). No cycles detected; dependency graph is a clean DAG: r3f-scaffolder -> scene-architect-3d -> {physics-engine-3d, asset-pipeline-3d, input-controller-3d} -> screen-grid-architect -> {save-bridge, screen-loader} -> edge-detector -> screen-transition-fx. data-schema-keeper and code-quality-reviewer have empty prerequisites.\n\nsequencing.yaml agent definition files — KNOWN GAPS (informational, not FAIL): screen-grid-architect, save-bridge, screen-loader, edge-detector, screen-transition-fx have no .claude/agents/<name>.md — these are documented known gaps queued for later authoring. All other agents (scene-architect-3d, physics-engine-3d, asset-pipeline-3d, input-controller-3d, data-schema-keeper, code-quality-reviewer) have definition files confirmed present.\n\nasset-manifest.schema.json — PASS: Valid JSON Schema draft-07 ($schema field present, type=object, required=[screen_id], properties block defined, additionalProperties=true at root and all item levels).\n\nproof-of-life.manifest.json — PASS: Required field screen_id present (value: proof-of-life). Extra field _note is permitted by additionalProperties=true. Structurally valid against the schema.\n\nworld-grid.json — NOT PRESENT: No action required.\n\nsave schema — NOT PRESENT: No action required."
}
