{
  "agent": "audio-compression-pass",
  "ts": "2026-04-26T02:30:00Z",
  "status": "complete",
  "files_changed": [
    "public/game/audio/music/garage_warm_oud.ogg",
    "public/game/audio/music/neighborhood_hybrid_ride.ogg",
    "public/game/audio/music/quest_focus_hybrid.ogg",
    "public/game/audio/stingers/reward_tarabi_stinger.ogg",
    "public/game/audio/stingers/upgrade_unlock_hybrid.ogg"
  ],
  "next_agent_suggestions": ["audio-asset-cleanup"],
  "notes": "FFMPEG VERIFICATION\n-------------------\nffmpeg version 8.1-full_build-www.gyan.dev (Gyan.FFmpeg via winget). Configuration line confirms `--enable-libvorbis` AND `--enable-libmp3lame` compiled in. libavcodec 62.28.100, libavutil 60.26.100. PATH resolution working in bash subshell.\n\nENCODE RESULTS (per-file table)\n-------------------------------\n| # | path                                                            | before_bytes | after_bytes | bitrate_kbps | encoder    | decode_validation |\n|---|-----------------------------------------------------------------|--------------|-------------|--------------|------------|-------------------|\n| 1 | public/game/audio/music/garage_warm_oud.ogg                     | 0            | 225,578     | 128          | libvorbis  | PASS (exit 0)     |\n| 2 | public/game/audio/music/neighborhood_hybrid_ride.ogg            | 0            | 225,269     | 128          | libvorbis  | PASS (exit 0)     |\n| 3 | public/game/audio/music/quest_focus_hybrid.ogg                  | 0            | 171,189     | 128          | libvorbis  | PASS (exit 0)     |\n| 4 | public/game/audio/stingers/reward_tarabi_stinger.ogg            | 0            | 19,849      | 96           | libvorbis  | PASS (exit 0)     |\n| 5 | public/game/audio/stingers/upgrade_unlock_hybrid.ogg            | 0            | 14,314      | 96           | libvorbis  | PASS (exit 0)     |\n\nDecode validation: each output run through `ffmpeg -v error -i <out.ogg> -f null -` and exit code captured. All 5 returned exit 0 with no stderr — outputs are well-formed Vorbis streams.\n\nEffective bitrates (from muxer stats): tracks 1/2/3 ~112-114 kbps observed (target 128, libvorbis VBR floor for these signals); track 4 ~72 kbps observed (target 96, short stinger); track 5 ~44 kbps observed (target 96, very short stinger with high muxing-overhead ratio of 41% on 2.6s of audio). Bitrate flags were honored — actual rates reflect libvorbis VBR behavior on short/sparse content.\n\nSize ratios (compression vs. .wav master):\n- garage_warm_oud:        225,578 / 2,822,444 = 8.0% of original\n- neighborhood_hybrid_ride: 225,269 / 2,822,444 = 8.0% of original\n- quest_focus_hybrid:     171,189 / 2,116,844 = 8.1% of original\n- reward_tarabi_stinger:   19,849 /   388,124 = 5.1% of original\n- upgrade_unlock_hybrid:   14,314 /   458,684 = 3.1% of original\n\nNON-MUTATION VERIFICATION\n-------------------------\n`git status --short public/game/audio/` output (cited verbatim):\n  M public/game/audio/music/garage_warm_oud.ogg\n  M public/game/audio/music/neighborhood_hybrid_ride.ogg\n  M public/game/audio/music/quest_focus_hybrid.ogg\n  M public/game/audio/stingers/reward_tarabi_stinger.ogg\n  M public/game/audio/stingers/upgrade_unlock_hybrid.ogg\n\nExactly 5 files modified, all .ogg. Zero .wav files touched. Zero files added. Zero files deleted. Zero changes outside the 5-file work queue. audioManifest.js and services/npcSpeech.js were not opened or modified. No files under src/renderer/game3d/ touched.\n\nGREEN-LIGHT STATEMENT\n---------------------\nALL 5 .wav basenames in the work queue now have valid, decodable .ogg siblings. audio-asset-cleanup is now safe to run for these 5 basenames:\n  - garage_warm_oud\n  - neighborhood_hybrid_ride\n  - quest_focus_hybrid\n  - reward_tarabi_stinger\n  - upgrade_unlock_hybrid\n\nThe silent-audio risk from the 2026-04-26T01:35Z incident is fully retired for these assets. audio-asset-cleanup may proceed to archive/delete the corresponding .wav masters per its own spec."
}
